{
  "schema": "KawoStartRecipe/v1",
  "id": "ready-runway34",
  "selector": "kawo-prototype-v1",
  "model_identity": {
    "id": "original-interactive-prototype",
    "version": "0.1.0-prototype",
    "backend_model": "original-interactive"
  },
  "named_start": "ground-ready",
  "wind_profile": "calm",
  "seed": "42",
  "clock": {
    "purpose": "runtime",
    "tick_rate_hz": 120
  },
  "position": {
    "latitude_rad": {
      "$binary64_le": "a0f390632ae5ea3f"
    },
    "longitude_rad": {
      "$binary64_le": "634f78ac640e01c0"
    },
    "ellipsoid_height_m": {
      "$binary64_le": "0000208d78933140"
    }
  },
  "orientation_rpy_ned_rad": {
    "roll": {
      "$binary64_le": "ebee121fa4e24b3f"
    },
    "pitch": {
      "$binary64_le": "d3552f7b5a31723f"
    },
    "yaw": {
      "$binary64_le": "df66cb25d8111940"
    }
  }
}
